{
  "source": "ruling:sam-2026-09-29c",
  "extractHash": "10ac71d60e646ad274d81254ba4ca3dc89d34b9b4df16cf99f42df085abca1c5",
  "verdicts": [
    {
      "id": "sam3-001",
      "holds": true,
      "reason": "Quote 'k6 is a decision jmeter is no.' is present verbatim in the source and directly supports both parts of the claim: k6 is the decided tool, JMeter is not used."
    }
  ],
  "missed": []
}
